{
  "finding_id": "sha256:cbd1d2d79e69b8cc63e6879e3f063db2c241a1b14c16c8f05b70c1a078eb15bc",
  "identity_eligibility": "ELIGIBLE",
  "violation_discriminator": "VIOLATION",
  "rule_id": "ARCH-DEPENDENCY-001",
  "integrity_tier": 1,
  "category": "architecture",
  "state": "FAIL",
  "entities": ["AF-A", "AF-B", "AF-A"],
  "location": {
    "path": null,
    "span": null,
    "symbol": null
  },
  "message": "CCG Module capability dependency graph contains a cycle: AF-A -> AF-B -> AF-A.",
  "remediation": "Separate responsibilities to restore one-way dependency flow or model a genuinely inseparable strongly connected cluster as one Module. A temporary exception requires a governed transition or exemption.",
  "evaluator": {
    "id": "fortress-core/architecture",
    "version": "0.1.0"
  },
  "standard_edition": "1.0.0-draft.1"
}
